{
  "$schema": "./schema/sources.schema.json",
  "schema_version": 1,
  "presets": ["ai-news", "general-news"],
  "interests": {
    "keywords": [],
    "boost": 0.15
  },
  "sources": [
    {
      "id": "ics_calendars",
      "category": "private",
      "type": "ics",
      "section": "schedule",
      "name": "My calendars",
      "secret_ref": ["ICS_SOURCES_B64"],
      "enabled": "auto"
    },
    {
      "id": "canvas",
      "category": "private",
      "type": "canvas",
      "section": "courses",
      "name": "Canvas",
      "secret_ref": ["CANVAS_BASE_URL", "CANVAS_TOKEN"],
      "enabled": "auto"
    }
  ]
}
